<?xml version="1.0" encoding="UTF-8"?>
<zzs:zahtev xmlns:zzs="http://www.ftn.uns.ac.rs/zahtev_zelenog_sertifikata"
 xmlns:pred="http://www.ftn.uns.ac.rs/predicate"
 xmlns:xsi="http://www.w3.org/2001/XMLSchema-instance"
 xsi:schemaLocation="http://www.ftn.uns.ac.rs/zahtev_zelenog_sertifikata ZahtevZelenogSertifikata.xsd" about="">
    <zzs:Podnosilac_zahteva>
        <zzs:Ime_i_prezime property="pred:ime_i_prezime" datatype="xs:string">Petar Markovic</zzs:Ime_i_prezime>
        <zzs:Datum_rodjenja>1999-10-29</zzs:Datum_rodjenja>
        <zzs:Pol>Musko</zzs:Pol>
        <zzs:Jedinstveni_maticni_broj_gradjana property="pred:jmbg" datatype="xs:string">29101999730020</zzs:Jedinstveni_maticni_broj_gradjana>
        <zzs:Broj_pasosa property="pred:broj_pasosa" datatype="xs:string">100321032</zzs:Broj_pasosa>
    </zzs:Podnosilac_zahteva>
    <zzs:Informacije_o_zahtevu>
        <zzs:Razlog>Neki razlog</zzs:Razlog>
        <zzs:Mesto>Novi Sad</zzs:Mesto>
        <zzs:Datum_izdavanja property="pred:datum" datatype="xs:date">2021-05-04</zzs:Datum_izdavanja>
    </zzs:Informacije_o_zahtevu>
</zzs:zahtev>
